{
  "schema_version": "1.0",
  "provenance": {
    "mock": true,
    "fictional": true,
    "generator": "compound-engine",
    "generator_version": "0.1.0",
    "compound_id": "business-dispute-cascade",
    "seed": 7
  },
  "universe_id": "UNIV-business-dispute-cascade-0007",
  "title": "Rise and dispute of Evergreen Analytics LLC",
  "theme": "Evergreen Analytics LLC, founded by Nadia P. Loe, incorporates and raises capital, and is then sued by its investors for misrepresentations in the offering.",
  "narrative": "Nadia P. Loe formed Evergreen Analytics LLC and elected S-corporation status. The company later raised money from Felix B. Fairbanks and Rosa B. Ellsworth, who now sue the company, its CEO Nadia P. Loe, and the outside auditor Northstar Builders LLC over alleged misrepresentations in the offering. The same company and founder appear as the applicant in the formation matter and as defendants in the litigation, tying the transactional and litigation matters into one story.\n",
  "cast": [
    {
      "cast_id": "founder",
      "kind": "person",
      "name": "Nadia P. Loe",
      "description": "Founder and CEO",
      "appears_as": [
        {
          "matter_id": "formation",
          "role": "applicant"
        },
        {
          "matter_id": "litigation",
          "role": "defendant_2"
        }
      ]
    },
    {
      "cast_id": "company",
      "kind": "organization",
      "name": "Evergreen Analytics LLC",
      "description": "The company",
      "appears_as": [
        {
          "matter_id": "formation",
          "role": "company"
        },
        {
          "matter_id": "litigation",
          "role": "defendant"
        }
      ]
    },
    {
      "cast_id": "investor",
      "kind": "person",
      "name": "Felix B. Fairbanks",
      "description": "Lead investor (the litigation client)",
      "appears_as": [
        {
          "matter_id": "litigation",
          "role": "plaintiff"
        }
      ]
    },
    {
      "cast_id": "co_investor",
      "kind": "person",
      "name": "Rosa B. Ellsworth",
      "description": "Co-investor",
      "appears_as": [
        {
          "matter_id": "litigation",
          "role": "plaintiff_2"
        }
      ]
    },
    {
      "cast_id": "auditor",
      "kind": "organization",
      "name": "Northstar Builders LLC",
      "description": "Outside auditor",
      "appears_as": [
        {
          "matter_id": "litigation",
          "role": "third_party_defendant"
        }
      ]
    }
  ],
  "matters": [
    {
      "schema_version": "1.0",
      "provenance": {
        "mock": true,
        "fictional": true,
        "generator": "deterministic-engine",
        "generator_version": "0.1.0",
        "scenario_id": "business-formation-scorp",
        "seed": 7001
      },
      "matter": {
        "matter_id": "MMC-2026-560900",
        "practice_area": "business",
        "title": "Formation of Evergreen Analytics LLC and S-Corporation Election by Nadia P. Loe",
        "jurisdiction": {
          "state": "ME",
          "county": "Kennebec",
          "court_location": "Augusta",
          "court_type": "Maine Secretary of State / IRS (filing offices)"
        },
        "case_type": "entity_formation",
        "filing_date": "2026-04-30",
        "status": "intake",
        "summary": "Nadia P. Loe is forming Evergreen Analytics LLC, a Maine corporation engaged in retail of specialty goods, and electing S-corporation status effective 2026-03-16; the engagement covers the Articles of Incorporation, the EIN application (Form SS-4), the timely S-election (Form 2553), and Maine corporate and payroll-withholding registration.",
        "event_date": "2026-03-16",
        "universe_id": "UNIV-business-dispute-cascade-0007"
      },
      "parties": {
        "applicant": {
          "entity_type": "person",
          "first_name": "Nadia",
          "middle_name": "P",
          "last_name": "Loe",
          "full_name": "Nadia P. Loe",
          "address": "335 Pine Lane",
          "city": "Falmouth",
          "state": "ME",
          "zip": "04069",
          "phone": "(207) 555-0112",
          "email": "nadia.loe@example.org",
          "date_of_birth": "1964-01-30",
          "ssn_last4": "8313",
          "role": "Founder / responsible party"
        },
        "company": {
          "entity_type": "organization",
          "organization_name": "Evergreen Analytics LLC",
          "full_name": "Evergreen Analytics LLC",
          "address": "224 Lighthouse Drive",
          "city": "Falmouth",
          "state": "ME",
          "zip": "04031",
          "phone": "(207) 555-0111",
          "role": "Newly formed Maine corporation"
        },
        "attorney": {
          "entity_type": "person",
          "first_name": "Nadia",
          "middle_name": "E",
          "last_name": "Danforth",
          "full_name": "Nadia E. Danforth",
          "role": "Attorney for the client",
          "address": "341 Harbor Road",
          "city": "Yarmouth",
          "state": "ME",
          "zip": "04046",
          "phone": "(207) 555-0124",
          "email": "nadia.danforth@example.net",
          "date_of_birth": "1970-04-29",
          "ssn_last4": "2431",
          "bar_number": "5753",
          "organization_name": "Hawthorne Legal Group"
        },
        "client": {
          "entity_type": "person",
          "first_name": "Nadia",
          "middle_name": "P",
          "last_name": "Loe",
          "full_name": "Nadia P. Loe",
          "address": "335 Pine Lane",
          "city": "Falmouth",
          "state": "ME",
          "zip": "04069",
          "phone": "(207) 555-0112",
          "email": "nadia.loe@example.org",
          "date_of_birth": "1964-01-30",
          "ssn_last4": "8313",
          "role": "Founder / responsible party"
        }
      },
      "fact_pattern": {
        "summary": "Nadia P. Loe is forming Evergreen Analytics LLC, a Maine corporation engaged in retail of specialty goods, and electing S-corporation status effective 2026-03-16; the engagement covers the Articles of Incorporation, the EIN application (Form SS-4), the timely S-election (Form 2553), and Maine corporate and payroll-withholding registration.",
        "narrative": "Nadia P. Loe is the founder and IRS responsible party for Evergreen Analytics LLC, a new corporation being organized in Maine to carry on retail of specialty goods. Articles of Incorporation were filed with the Maine Secretary of State with an incorporation date of 2026-03-16, and the corporation will have 3 shareholder(s) at formation.\n\nThe founder intends to elect S-corporation treatment under Subchapter S so that the corporation's income passes through to the shareholders, electing on a calendar year basis with a fiscal year end of December 31 and effective on 2026-03-16. The corporation expects 0 employee(s) and plans to begin payroll on or about 2026-01-18, using the accrual method of accounting and reporting under NAICS code 561730.\n\nBecause S-corporation owner-employees must be paid reasonable wages, the founder plans owner compensation of approximately $39970 per year and projects first-year revenue near $162577. The remaining work is to obtain an EIN on Form SS-4, file Form 2553 within the statutory window so the election is timely, register with Maine Revenue Services for corporate income tax and employer withholding, and set up payroll so the first Maine wage filings are correct.",
        "undisputed_facts": [
          "Evergreen Analytics LLC is being organized as a corporation in Maine with an incorporation date of 2026-03-16.",
          "Nadia P. Loe is the founder and the IRS responsible party for the corporation.",
          "The corporation intends to elect S-corporation status effective 2026-03-16.",
          "The corporation expects 3 shareholder(s) and approximately 0 employee(s) in its first year."
        ],
        "disputed_facts": [
          "Whether owner compensation of approximately $39970 satisfies the reasonable-compensation standard for an S-corporation owner-employee given the activity and revenue.",
          "Whether the Form 2553 election will be filed within the statutory window so that S status is effective on 2026-03-16 without needing late-election relief.",
          "Whether the accrual method of accounting is the appropriate choice for the corporation's first tax year."
        ],
        "timeline": [
          {
            "date": "2026-01-18",
            "event": "Corporation begins payroll for its owner-employee and any staff, triggering Maine withholding obligations."
          },
          {
            "date": "2026-03-16",
            "event": "Articles of Incorporation for Evergreen Analytics LLC filed with the Maine Secretary of State."
          },
          {
            "date": "2026-04-30",
            "event": "EIN application (Form SS-4) and S-election (Form 2553) prepared for filing with the IRS for Evergreen Analytics LLC."
          }
        ]
      },
      "third_parties": [
        {
          "id": "tp1",
          "name": "Diego T. Ashford",
          "type": "witness",
          "role": "Co-founder and shareholder",
          "relationship": "Fellow shareholder of the corporation",
          "relevance": "A second shareholder whose eligibility affects the S-corporation election and who must consent on Form 2553.",
          "contact": {
            "phone": "(207) 555-0151",
            "city": "Augusta",
            "state": "ME",
            "email": "diego.ashford@example.net"
          }
        },
        {
          "id": "tp2",
          "name": "Internal Revenue Service",
          "type": "government_agency",
          "role": "Federal tax authority",
          "relevance": "Issues the EIN on Form SS-4 and processes the Form 2553 S-corporation election.",
          "contact": {
            "phone": "(207) 555-0198",
            "city": "Waterville",